user,date,content,replyCount,retweetCount,likeCount
Jsipple,[  10    3 2013],Thanks QUB colleagues for hosting a wonderfully productive meeting. @tarrnetwork @cornell @aberdeenuni @queensubelfast @penn_state,0,0,1
Jsipple,[   9    2 2013],"Enrollment projections for all NYS school districts updated through 2020
http://t.co/mg9orJfygQ",0,0,0
Jsipple,[   7    2 2013],Just a friendly reminder for all NYS School Superintendents to complete the shared services study survey. Check your inbox for an email fro…,0,0,0
Jsipple,[   6    2 2013],@Fmarcoux3949  Coffee hour tomorrow!!,0,0,0
Jsipple,[   6    2 2013],Fabulous new County Profiles - now available from our colleagues at PAD and CCE. http://t.co/DPMhmf8L,0,0,0
Jsipple,[  51   12 2012],Budget Playground by Cornell University http://t.co/SvCgDRTD,0,0,0
Jsipple,[  38    9 2012],@tsipple congrats T!,0,0,0
Jsipple,[  26    6 2012],"@mbreidenbach The links are on the right side of the CU release. http://t.co/iOpu59Aq, http://t.co/45UneYXH, http://t.co/JvAbtgj3.",1,0,0
Jsipple,[  26    6 2012],"@mbreidenbach We met at our ""State of Upstate"" conference. Thought you might find these tools useful to the citizens and educators in NYS.",0,0,0
Jsipple,[  26    6 2012],"@nyschoolboards New Data Tools released by Cornell. Useful to educators, media, taxpayers, government officials. see http://t.co/wDAxLHat",0,0,0
Jsipple,[  26    6 2012],"@mbreidenbach New Data Tools released by Cornell. Useful to educators, media, taxpayers, and government officials. see http://t.co/wDAxLHat",1,0,0
Jsipple,[  24    6 2012],"@prismdecision  Great news here. Once you use it you will love it. In you are in a CNYRIC district, check it out.",0,0,0
Jsipple,[  20    5 2012],Schools nearing the brink - Times Union http://t.co/MtMg3DRE,0,0,0
Jsipple,[  20    5 2012],"A great organization. Timely, important, and good work. Check out the 3 briefs. http://t.co/pwXsF2Fp",0,0,0
Jsipple,[  18    4 2012],This is an interesting set of presentations today. You can view them live online or at a later date. The topics includ…http://t.co/FKYu41CD,0,0,0
Jsipple,[  18    4 2012],"Last thursday, Joe Morgan and I presented to the WSWHE Data Conference. Here are the slides that highlight the data to…http://t.co/Ez0grhIY",0,0,0
Jsipple,[  16    4 2012],Note the section on Regional High schools on page 6 and a highlighting of our Data Tools on page 7. http://t.co/grZHTCrG,0,0,0
Jsipple,[  15    4 2012],"Here is a useful set of resources for School District, County, and other municipal governments. http://t.co/LPQCN4cp",0,0,0
Jsipple,[  15    4 2012],A nice update by PAD using the latest data available. http://t.co/l4SIaPEI,0,0,0
Jsipple,[  23    6 2011],"A daily diaspora, a scattered street http://t.co/RGRJ9kX",0,0,0
